<?xml version="1.0" encoding="UTF-8"?>

<!--
    Document   : jSmaTeP-Export-Config.xml
    Created on : 19. August 2009, 21:47
    Author     : Manfred Kardass
    Description:
        Purpose of the document follows.
-->

<ns0:jSmaTeP-Composer-Config  xmlns:xsi='http://www.w3.org/2001/XMLSchema-instance'
   xmlns:ns0='http://jsmatep.kardass.com/schema/jSmaTeP-Composer-Config'
   xsi:schemaLocation='http://jsmatep.kardass.com/schema/jSmaTeP-Composer-Config jSmaTeP-Composer-Config.xsd' version="0.1">
    <ns0:type>
        <ns0:fixed-length record-length="55"></ns0:fixed-length>
    </ns0:type>
    <ns0:value-object>de.kardass.jsmatep.out.ExporterTestValueObject</ns0:value-object>
    <ns0:fields>
        <ns0:field name="a" position="0" length="2" type="String"></ns0:field>
        <ns0:field name="b" position="2" length="8" type="Date" format="yyyyMMdd"></ns0:field>
        <ns0:field name="c" position="10" length="3" type="Integer"></ns0:field>
        <ns0:field name="d" position="13" length="5" type="float"></ns0:field>
        <ns0:field name="e" position="18" length="5" type="Decimal"></ns0:field>
        <ns0:field name="f" position="23" length="1" type="String"></ns0:field>
        <ns0:field name="g" position="24" length="5" type="Decimal" format="0.00" show-decimal-separator="false"></ns0:field>
        <ns0:field name="h" position="29" length="6" type="Decimal" format="0.00" show-decimal-separator="true"></ns0:field>
        <ns0:field name="i" position="35" length="10" type="Decimal" format="0.00" show-decimal-separator="false" fill-left=" "></ns0:field>
        <ns0:field name="j" position="45" length="10" type="Decimal" format="0.00" show-decimal-separator="true" fill-right="-"></ns0:field>
    </ns0:fields>

</ns0:jSmaTeP-Composer-Config>
